{
  "schemaVersion": 1,
  "songId": "bbbbbbbbbbbbbbbbbbbbbbbbbbbbbbbbbbbbbbbbbbbbbbbbbbbbbbbbbbbbbbbb",
  "displayName": "练习 曲目.flac",
  "sourceExtension": "flac",
  "originalRelativePath": "data/songs/bbbbbbbbbbbbbbbbbbbbbbbbbbbbbbbbbbbbbbbbbbbbbbbbbbbbbbbbbbbbbbbb/original.flac",
  "durationMs": 234123,
  "importedAt": "2026-08-25T01:00:00Z",
  "updatedAt": "2026-08-25T01:00:00Z",
  "status": "ready",
  "activeAnalysisId": "cccccccccccccccccccccccccccccccc",
  "lastPracticeAt": "2026-08-25T02:00:00Z"
}
